{
  "$schema": "https://json-schema.org/draft/2020-12/schema",
  "$id": "https://prototype-factory.local/schemas/hub-factory-policy.schema.json",
  "title": "Factory Core Agent Policy · platform / catalog-hub",
  "description": "机器可读的 Factory Core 管理策略（v1.3.0）在**平台/目录仓**上的形态。它是 AGENTS.md 里 `<!-- BEGIN:factory-core-policy v1.3.0 -->` 管理块的唯一来源：`pnpm factory:agents --print-block` 由本文件渲染块，`pnpm factory:agents` 逐字校验块与它一致。这里的 `const` 就是「关键值」——校验器不另外抄一份常量，改策略必须改这里。\n\n与产品仓版本的差别只有一处：多一个 `repositoryRole`。prototype-hub 不是从 Factory 基线派生的产品，它拥有一个产品仓没有的面（catalog 投影），并且它自己的 `factory.lock.json` 必须是 `kind: catalog-hub`。把角色写成别的值会让下游判断（基线身份、产品形状、部署归属）全部错位，所以它被钉成 const。",
  "type": "object",
  "additionalProperties": false,
  "required": [
    "schemaVersion",
    "repositoryRole",
    "policyVersion",
    "managedBlock",
    "agentOrchestration",
    "modelRouting",
    "concurrency",
    "authorization"
  ],
  "properties": {
    "$schema": { "type": "string" },
    "schemaVersion": {
      "const": 1,
      "description": "本契约的版本。"
    },
    "repositoryRole": {
      "const": "platform-catalog-hub",
      "description": "本仓的角色：平台/目录仓，不是产品。它决定锁的形状（kind: catalog-hub）、它的门禁（catalog:sync / catalog:check）以及它不被 Vercel Git Integration 当作产品部署。"
    },
    "policyVersion": {
      "const": "1.3.0",
      "description": "管理策略版本。与管理块的 BEGIN 标记中的版本号必须一致。"
    },
    "managedBlock": {
      "type": "object",
      "additionalProperties": false,
      "required": ["document", "marker", "version", "begin", "end"],
      "description": "AGENTS.md 里由本策略拥有的块。块内文本可同步（`--print-block`），块外是人类写的文档。",
      "properties": {
        "document": { "const": "AGENTS.md" },
        "marker": { "const": "factory-core-policy" },
        "version": { "const": "1.3.0" },
        "begin": { "const": "<!-- BEGIN:factory-core-policy v1.3.0 -->" },
        "end": { "const": "<!-- END:factory-core-policy -->" }
      }
    },
    "agentOrchestration": {
      "type": "object",
      "additionalProperties": false,
      "required": ["host", "dshSubagents", "productAppFrameworks", "allowedScope", "forbiddenScope"],
      "description": "v1.3.0 替换掉 v1.2 的「禁止 Multi-agent orchestration」。那是一条过宽的禁令：它同时ban掉了宿主侧的 agent 拆分与本该ban掉的东西，于是规则要么被违反、要么把合法的编排也一起掐死。边界改成两条并存的事实。",
      "properties": {
        "host": {
          "const": "dsh",
          "description": "编排发生在宿主（DeepSeek Harness）侧，不在应用代码里。"
        },
        "dshSubagents": {
          "const": "required",
          "description": "在 DSH 宿主内使用多 Subagent 拆分/并行任务是被允许、且被要求的：单 agent 串行做完大范围调研既慢又丢上下文。本仓的投影改造与治理采纳正是这样做的。"
        },
        "productAppFrameworks": {
          "const": "forbidden",
          "description": "产品/应用代码里禁止引入编排框架或编排运行时。hub 自己也是一个 Next.js 应用，所以这条对 app/components/lib/hooks/stores/scripts 同样成立。"
        },
        "allowedScope": {
          "type": "string",
          "minLength": 1,
          "description": "许可范围的边界描述，必须与 AGENTS.md 管理块表述一致。"
        },
        "forbiddenScope": {
          "type": "string",
          "minLength": 1,
          "description": "禁止范围的边界描述，必须与 AGENTS.md 管理块表述一致。"
        }
      }
    },
    "modelRouting": {
      "type": "object",
      "additionalProperties": false,
      "required": ["provider", "model", "reasoningEffort", "verifiedOn"],
      "description": "Subagent 与协作任务的默认路由。三个值不是抄来的约定，是 2026-09-17 用 DSH 模型目录核出来的：provider `commandcode` 广告 model `deepseek/deepseek-v4.1-flash`。",
      "properties": {
        "provider": { "const": "commandcode" },
        "model": { "const": "deepseek/deepseek-v4.1-flash" },
        "reasoningEffort": {
          "const": "max",
          "description": "该 provider 广告 low/medium/high/max；策略钉住 max。"
        },
        "verifiedOn": {
          "const": "2026-09-17",
          "description": "路由值与 DSH 模型目录比对的日期。路由变了要重新核，而不是让这里慢慢过期。"
        }
      }
    },
    "concurrency": {
      "type": "object",
      "additionalProperties": false,
      "required": ["worktree", "sharedPaths", "testAndQa"],
      "description": "并行是手段，不是目标。这三条约束的是「怎么写」而不是「写多快」。",
      "properties": {
        "worktree": {
          "const": "single-writer",
          "description": "单 worktree 单写者：同一棵工作副本同一时间只有一个写者。要并行写就各自独立 worktree——两个写者共享一棵树，冲突不是概率问题，是时间问题。"
        },
        "sharedPaths": {
          "const": "single-owner",
          "description": "共享路径单 owner：AGENTS.md、package.json、工厂契约与生成物 lib/generated/factory-catalog.json 这类共享面，同一时间只有一个 owner，其余只读。"
        },
        "testAndQa": {
          "const": "serial",
          "description": "test 与 qa 串行：永不并发（Next 16 的 dev server 按项目加锁，并行只会在错误的 server 上出结果）。CI 里同样不得拆成两个并行 job。"
        }
      }
    },
    "authorization": {
      "type": "object",
      "additionalProperties": false,
      "required": ["humanVisualAcceptance", "deployment"],
      "description": "两道人工闸门。Agent 可以准备证据，不能代替人按按钮。",
      "properties": {
        "humanVisualAcceptance": {
          "const": "required-before-release",
          "description": "HVA（人工视觉验收）先于发布。未完成时状态只能是 READY FOR HUMAN VISUAL ACCEPTANCE。"
        },
        "deployment": {
          "const": "explicit-user-authorization",
          "description": "部署是独立的一次人工授权：源码发布 ≠ Production 部署。详细契约见 docs/deployment.md 第 0 节。"
        }
      }
    }
  }
}
